{
  "fragments": [
    {
      "hash": "a1b2c3d4e5f6789012345678abcdef01",
      "resolved_from": "base",
      "src": "fragments/intro.template.md"
    },
    {
      "hash": "b2c3d4e5f6789012345678abcdef0102",
      "resolved_from": "base",
      "src": "fragments/guide.template.md"
    }
  ],
  "schema_version": 1,
  "toml_fields": [
    {
      "current_value": "A base skill.",
      "default_value": "A base skill.",
      "layers": {
        "base": {
          "hash": "d4e5f6789012345678abcdef01020304",
          "value": "A base skill."
        }
      },
      "path": "agent.description"
    },
    {
      "current_value": "SkillA",
      "default_value": "SkillA",
      "layers": {
        "base": {
          "hash": "c3d4e5f6789012345678abcdef010203",
          "value": "SkillA"
        }
      },
      "path": "agent.name"
    }
  ],
  "variables": [
    {
      "name": "self.agent.name",
      "resolved_at": "compile-time",
      "source": "toml",
      "source_path": "mock-module/skill-a/customize.toml",
      "toml_layer": "base",
      "value": "SkillA"
    }
  ]
}
