{
  "fragments": [
    {
      "hash": "a1b2c3d4e5f6789012345678abcdef01",
      "resolved_from": "base",
      "src": "fragments/intro.template.md"
    }
  ],
  "schema_version": 1,
  "toml_fields": [
    {
      "current_value": "MyCustomSkill",
      "default_value": "SkillA",
      "layers": {
        "base": {
          "hash": "c3d4e5f6789012345678abcdef010203",
          "value": "SkillA"
        },
        "user": {
          "hash": "f6789012345678abcdef010203040506",
          "value": "MyCustomSkill"
        }
      },
      "path": "agent.name"
    }
  ],
  "variables": [
    {
      "name": "self.agent.name",
      "resolved_at": "compile-time",
      "source": "toml",
      "source_path": "custom/mock-module/skill-a.toml",
      "toml_layer": "user",
      "value": "MyCustomSkill"
    }
  ]
}
