{
  "fragments": [
    {
      "hash": "abcdef012345678901234567890abcde",
      "resolved_from": "base",
      "src": "fragments/menu-handler.template.md"
    }
  ],
  "schema_version": 1,
  "toml_fields": [
    {
      "current_value": "SkillA",
      "default_value": "SkillA",
      "layers": {
        "base": {
          "hash": "a5b6c7d8e9f0a1b2c3d4e5f6a7b8c9d0",
          "value": "SkillA"
        }
      },
      "path": "agent.name"
    }
  ],
  "variables": []
}
